{
  "$schema": "https://json-schema.org/draft/2020-12/schema",
  "type": "object",
  "properties": {
    "$schema": { "type": "string" },
    "fonts": { "type": "object" },
    "logo": { "type": "object" },
    "ogImages": { "oneOf": [{ "type": "string" }, { "type": "array", "items": { "type": "string" } }] },
    "mermaid": { "type": "object" }
  },
  "additionalProperties": false
}
